{
  "jurisdiction": "IL",
  "jurisdictionName": "Illinois",
  "statuteVersion": "2026.1",
  "lastAudited": "2026-09-01",
  "officialSourceUrl": "https://www.ilga.gov/legislation/ilcs/ilcs.asp",
  "rules": [
    {
      "id": "IL-SEC-DEP-RET-01",
      "category": "SecurityDeposit",
      "name": "Security Deposit Return Act (30-Day Itemization / 45-Day Return)",
      "severity": "LikelyUnenforceable",
      "statuteCitation": "765 ILCS 710/1",
      "statuteSummary": "For residential rental units in properties containing 5 or more units, a lessor who withholds any deposit for damage must deliver an itemized statement within 30 days of surrender, and must return the balance within 45 days. If no damage is claimed, full deposit must be returned within 45 days.",
      "officialUrl": "https://www.ilga.gov/legislation/ilcs/fulltext.asp?DocName=076507100K1",
      "triggerPatterns": [
        "(?:deposit|security)[^.\\n]{0,60}(?:sixty|ninety|[6-9]\\d|\\d{3})\\s*days\\s+(?:to\\s+return|to\\s+refund|after\\s+surrender)",
        "within\\s+(?:sixty|ninety|[6-9]\\d)\\s*days[^.\\n]{0,50}(?:return|refund)\\s+(?:the\\s+)?deposit"
      ],
      "contraIndicatorPatterns": [
        "30\\s+days",
        "45\\s+days"
      ],
      "disputeTemplate": "Under 765 ILCS 710/1 (Security Deposit Return Act), landlords in buildings with 5+ units must deliver an itemized statement within 30 days and return the deposit within 45 days. Longer lease provisions are unenforceable."
    },
    {
      "id": "IL-EVICT-SLF-02",
      "category": "EvictionLockout",
      "name": "Forcible Entry and Detainer Act (Self-Help Prohibition)",
      "severity": "LikelyUnenforceable",
      "statuteCitation": "735 ILCS 5/9-101 et seq.",
      "statuteSummary": "No person shall make an entry into lands or tenements except in cases where entry is allowed by law, and in such cases, only in a peaceable manner. Lockouts, taking possession by force, or self-help evictions outside court orders are strictly illegal.",
      "officialUrl": "https://www.ilga.gov/legislation/ilcs/fulltext.asp?DocName=073500050K9-101",
      "triggerPatterns": [
        "(?:lockout|change\\s+locks|repossess\\s+premises|padlock)[^.\\n]{0,60}(?:without\\s+court|without\\s+forcible\\s+entry|immediate\\s+possession)",
        "tenant\\s+waives?\\s+(?:any\\s+)?right\\s+to\\s+judicial\\s+eviction"
      ],
      "contraIndicatorPatterns": [],
      "disputeTemplate": "Under 735 ILCS 5/9-101, Illinois strictly prohibits self-help evictions. Landlords must obtain a judicial order of possession before barring tenant access or changing locks."
    },
    {
      "id": "IL-RETALIAT-03",
      "category": "General",
      "name": "Retaliatory Eviction Ban",
      "severity": "LikelyUnenforceable",
      "statuteCitation": "765 ILCS 720/1",
      "statuteSummary": "It is declared to be against public policy of Illinois for a landlord to terminate or refuse to renew a lease because a tenant has complained to any governmental authority regarding code or ordinance violations.",
      "officialUrl": "https://www.ilga.gov/legislation/ilcs/fulltext.asp?DocName=076507200K1",
      "triggerPatterns": [
        "(?:tenant\\s+agrees\\s+not\\s+to\\s+report|prohibited\\s+from\\s+complaining\\s+to\\s+city|waives\\s+right\\s+to\\s+report\\s+code)",
        "(?:landlord\\s+may\\s+terminate|immediate\\s+termination)\\s+(?:if\\s+tenant\\s+contacts|upon\\s+tenant\\s+complaint\\s+to\\s+(?:city|building|inspector))"
      ],
      "contraIndicatorPatterns": [],
      "disputeTemplate": "Under 765 ILCS 720/1, lease provisions punishing or restricting a tenant from reporting building code violations to municipal authorities are void as contrary to Illinois public policy."
    },
    {
      "id": "IL-DEP-INT-04",
      "category": "SecurityDeposit",
      "name": "Security Deposit Interest Act (25+ Units)",
      "severity": "LikelyUnenforceable",
      "statuteCitation": "765 ILCS 715/1",
      "statuteSummary": "A lessor of residential real property containing 25 or more units who receives a security deposit from a lessee and holds that deposit for more than 6 months shall pay interest annually to the lessee on the deposit at the rate established by the State Treasurer. Any lease waiver of deposit interest in covered buildings is void and unenforceable.",
      "officialUrl": "https://www.ilga.gov/legislation/ilcs/fulltext.asp?DocName=076507150K1",
      "triggerPatterns": [
        "(?:no\\s+interest|waives?\\s+(?:any\\s+)?interest|interest-free)[^.\\n]{0,60}(?:on\\s+(?:the\\s+)?(?:security\\s+)?deposit|held\\s+in\\s+escrow)",
        "tenant\\s+waives?\\s+(?:all\\s+)?rights?\\s+under\\s+(?:the\\s+)?security\\s+deposit\\s+interest\\s+act",
        "deposit\\s+(?:shall|will)\\s+not\\s+bear\\s+interest"
      ],
      "contraIndicatorPatterns": [
        "less\\s+than\\s+25\\s+units",
        "single-family"
      ],
      "disputeTemplate": "Under 765 ILCS 715/1 (Security Deposit Interest Act), landlords of buildings containing 25 or more units must pay annual interest on security deposits held over 6 months. Blanket lease waivers of deposit interest in covered properties are unenforceable."
    }
  ]
}
